{
  "$schema": "../../schema/sprite.schema.json",
  "id": "relic_shield_breaker",
  "kind": "relic",
  "cell": [
    4,
    3
  ],
  "source": "tools/placeholder-sprites.mjs (session 25 placeholder; a study in sources/sprites/ replaces it)",
  "states": {
    "": {
      "art": [
        "[\\/]",
        "[/\\]",
        " \\/ "
      ],
      "ink": [
        "abba",
        "abba",
        ".bb."
      ]
    }
  },
  "inkMap": {
    ".": null,
    "a": "ui.dim",
    "b": "relic.blood"
  }
}
