{
  "$schema": "../../schema/sprite.schema.json",
  "id": "relic_scrap_rain",
  "kind": "relic",
  "cell": [
    4,
    3
  ],
  "source": "tools/placeholder-sprites.mjs (session 25 placeholder; a study in sources/sprites/ replaces it)",
  "states": {
    "": {
      "art": [
        "' ' ",
        " $ $",
        "' ' "
      ],
      "ink": [
        "a.a.",
        ".b.b",
        "a.a."
      ]
    }
  },
  "inkMap": {
    ".": null,
    "a": "ui.dim",
    "b": "relic.gold"
  }
}
