{
  "$schema": "../../schema/sprite.schema.json",
  "id": "relic_tempered_steel",
  "kind": "relic",
  "cell": [
    4,
    3
  ],
  "source": "tools/placeholder-sprites.mjs (session 25 placeholder; a study in sources/sprites/ replaces it)",
  "states": {
    "": {
      "art": [
        "  /|",
        " /|/",
        "=+/ "
      ],
      "ink": [
        "..aa",
        ".aaa",
        "bba."
      ]
    }
  },
  "inkMap": {
    ".": null,
    "a": "relic.steel",
    "b": "ui.dim"
  }
}
