{
  "$schema": "../../schema/sprite.schema.json",
  "id": "relic_frostbite",
  "kind": "relic",
  "cell": [
    4,
    3
  ],
  "source": "tools/placeholder-sprites.mjs (session 25 placeholder; a study in sources/sprites/ replaces it)",
  "states": {
    "": {
      "art": [
        " \\|/",
        " -*-",
        " /|\\"
      ],
      "ink": [
        ".aaa",
        ".aba",
        ".aaa"
      ]
    }
  },
  "inkMap": {
    ".": null,
    "a": "ui.dim",
    "b": "relic.ice"
  }
}
