{
  "$schema": "../../schema/sprite.schema.json",
  "id": "relic_iron_sights",
  "kind": "relic",
  "cell": [
    4,
    3
  ],
  "source": "tools/placeholder-sprites.mjs (session 25 placeholder; a study in sources/sprites/ replaces it)",
  "states": {
    "": {
      "art": [
        " /\\ ",
        "-++-",
        " \\/ "
      ],
      "ink": [
        ".aa.",
        "bbbb",
        ".aa."
      ]
    }
  },
  "inkMap": {
    ".": null,
    "a": "ui.dim",
    "b": "relic.steel"
  }
}
