{
  "$schema": "../../schema/sprite.schema.json",
  "id": "relic_sandbags",
  "kind": "relic",
  "cell": [
    4,
    3
  ],
  "frameMs": 160,
  "source": "sources/sprites/approved-pack/studies/relic_sandbags.study.json; imported and assembled by package.py",
  "states": {
    "": {
      "art": [
        " __ ",
        "(⠒_)",
        "(__)"
      ],
      "ink": [
        ".aa.",
        "abaa",
        "aaaa"
      ],
      "bgInk": [
        "....",
        ".d..",
        "...."
      ],
      "frames": [
        {
          "art": [
            " __ ",
            "(⠲_)",
            "(__)"
          ],
          "ink": [
            ".aa.",
            "abaa",
            "aaaa"
          ],
          "bgInk": [
            "....",
            ".d..",
            "...."
          ]
        },
        {
          "art": [
            " __ ",
            "(⠴_)",
            "(__)"
          ],
          "ink": [
            ".aa.",
            "abaa",
            "aaaa"
          ],
          "bgInk": [
            "....",
            ".d..",
            "...."
          ]
        },
        {
          "art": [
            " __ ",
            "(⠤_)",
            "(__)"
          ],
          "ink": [
            ".aa.",
            "abaa",
            "aaaa"
          ],
          "bgInk": [
            "....",
            ".d..",
            "...."
          ]
        },
        {
          "art": [
            " __ ",
            "(⠔_)",
            "(__)"
          ],
          "ink": [
            ".aa.",
            "abaa",
            "aaaa"
          ],
          "bgInk": [
            "....",
            ".d..",
            "...."
          ]
        }
      ]
    }
  },
  "inkMap": {
    "0": "relic.sandbags.review3_pulse_0",
    "1": "relic.sandbags.review3_pulse_1",
    "2": "relic.sandbags.review3_pulse_2",
    "3": "relic.sandbags.review3_pulse_3",
    "4": "relic.sandbags.review3_pulse_4",
    ".": null,
    "h": "relic.sandbags.review3_steel_high",
    "m": "relic.sandbags.review3_steel_mid",
    "l": "relic.sandbags.review3_steel_low",
    "a": "relic.sandbags.review3_accent",
    "b": "relic.sandbags.review3_accent_dim",
    "w": "relic.sandbags.review3_lens_high",
    "d": "relic.sandbags.review3_recess",
    "f": "relic.sandbags.review3_exhaust",
    "g": "relic.sandbags.review3_warm_metal",
    "t": "relic.sandbags.review3_body",
    "u": "relic.sandbags.review3_coolant"
  }
}
