{
  "$schema": "../../schema/sprite.schema.json",
  "id": "relic_salvage_rights",
  "kind": "relic",
  "cell": [
    4,
    3
  ],
  "source": "tools/placeholder-sprites.mjs (session 25 placeholder; a study in sources/sprites/ replaces it)",
  "states": {
    "": {
      "art": [
        "[$$]",
        "|<>|",
        "[__]"
      ],
      "ink": [
        "abba",
        "abba",
        "aaaa"
      ]
    }
  },
  "inkMap": {
    ".": null,
    "a": "ui.dim",
    "b": "relic.steel"
  }
}
