{
  "$schema": "../../schema/sprite.schema.json",
  "id": "relic_quarry_master",
  "kind": "relic",
  "cell": [
    4,
    3
  ],
  "source": "tools/placeholder-sprites.mjs (session 25 placeholder; a study in sources/sprites/ replaces it)",
  "states": {
    "": {
      "art": [
        "/\\/\\",
        "#oo#",
        "####"
      ],
      "ink": [
        "aaaa",
        "baab",
        "bbbb"
      ]
    }
  },
  "inkMap": {
    ".": null,
    "a": "relic.copper",
    "b": "ui.dim"
  }
}
