{
  "$schema": "../../schema/sprite.schema.json",
  "id": "relic_kindling",
  "kind": "relic",
  "cell": [
    4,
    3
  ],
  "source": "tools/placeholder-sprites.mjs (session 25 placeholder; a study in sources/sprites/ replaces it)",
  "states": {
    "": {
      "art": [
        " ^^ ",
        "^^^^",
        "|__|"
      ],
      "ink": [
        ".aa.",
        "aaaa",
        "bbbb"
      ]
    }
  },
  "inkMap": {
    ".": null,
    "a": "fx.ember",
    "b": "ui.dim"
  }
}
