{
  "$schema": "../../schema/sprite.schema.json",
  "id": "core_face",
  "kind": "face",
  "cell": [
    8,
    5
  ],
  "frameMs": 200,
  "source": "sources/sprites/approved-pack/studies/core_face.study.json; imported and assembled by package.py",
  "states": {
    "top": {
      "art": [
        "  ┌┐ ┌┐ ",
        " ┌┘└─┘└─",
        " │⣶⠒⣶⠒⣶⠒",
        "/├─┬─┬─┬",
        "⡜│[C]│:│"
      ],
      "ink": [
        "..ww.ww.",
        ".ttttttt",
        ".wjjjjjj",
        "wwwwwwww",
        "wwkFkwjw"
      ],
      "bgInk": [
        "..bb.bb.",
        "..bbbbbb",
        "..bbbbbb",
        "..bbbbbb",
        "..bbbbbb"
      ],
      "frames": [
        {
          "art": [
            "  ┌┐ ┌┐ ",
            " ┌┘└─┘└─",
            " │⣶⠒⣶⠒⣶⠒",
            "/├─┬─┬─┬",
            "⡜│[C]│:│"
          ],
          "ink": [
            "..ww.ww.",
            ".ttttttt",
            ".wjjjjjj",
            "wwwwwwww",
            "wwkGkwjw"
          ],
          "bgInk": [
            "..bb.bb.",
            "..bbbbbb",
            "..bbbbbb",
            "..bbbbbb",
            "..bbbbbb"
          ]
        },
        {
          "art": [
            "  ┌┐ ┌┐ ",
            " ┌┘└─┘└─",
            " │⣶⠒⣶⠒⣶⠒",
            "/├─┬─┬─┬",
            "⡜│[C]│:│"
          ],
          "ink": [
            "..ww.ww.",
            ".ttttttt",
            ".wjjjjjj",
            "wwwwwwww",
            "wwkHkwjw"
          ],
          "bgInk": [
            "..bb.bb.",
            "..bbbbbb",
            "..bbbbbb",
            "..bbbbbb",
            "..bbbbbb"
          ]
        },
        {
          "art": [
            "  ┌┐ ┌┐ ",
            " ┌┘└─┘└─",
            " │⣶⠒⣶⠒⣶⠒",
            "/├─┬─┬─┬",
            "⡜│[C]│:│"
          ],
          "ink": [
            "..ww.ww.",
            ".ttttttt",
            ".wjjjjjj",
            "wwwwwwww",
            "wwkIkwjw"
          ],
          "bgInk": [
            "..bb.bb.",
            "..bbbbbb",
            "..bbbbbb",
            "..bbbbbb",
            "..bbbbbb"
          ]
        },
        {
          "art": [
            "  ┌┐ ┌┐ ",
            " ┌┘└─┘└─",
            " │⣶⠒⣶⠒⣶⠒",
            "/├─┬─┬─┬",
            "⡜│[C]│:│"
          ],
          "ink": [
            "..ww.ww.",
            ".ttttttt",
            ".wjjjjjj",
            "wwwwwwww",
            "wwkJkwjw"
          ],
          "bgInk": [
            "..bb.bb.",
            "..bbbbbb",
            "..bbbbbb",
            "..bbbbbb",
            "..bbbbbb"
          ]
        }
      ]
    },
    "mid": {
      "art": [
        "│└┬┴─┴─┴",
        "├o┤/⠉⠉⠉⠉",
        "───=|||=",
        "├o┤\\____",
        "│┌┴┬─┬─┬"
      ],
      "ink": [
        "wwwwwwww",
        "wFwttttt",
        "wwwwGGGw",
        "wFwttttt",
        "wwwwwwww"
      ],
      "bgInk": [
        "..bbbbbb",
        "..bbbbbb",
        "..bbbbbb",
        "..bbbbbb",
        "..bbbbbb"
      ],
      "frames": [
        {
          "art": [
            "│└┬┴─┴─┴",
            "├o┤/⠉⠉⠉⠉",
            "───=|||=",
            "├o┤\\____",
            "│┌┴┬─┬─┬"
          ],
          "ink": [
            "wwwwwwww",
            "wGwttttt",
            "wwwwHHHw",
            "wGwttttt",
            "wwwwwwww"
          ],
          "bgInk": [
            "..bbbbbb",
            "..bbbbbb",
            "..bbbbbb",
            "..bbbbbb",
            "..bbbbbb"
          ]
        },
        {
          "art": [
            "│└┬┴─┴─┴",
            "├o┤/⠉⠉⠉⠉",
            "───=|||=",
            "├o┤\\____",
            "│┌┴┬─┬─┬"
          ],
          "ink": [
            "wwwwwwww",
            "wHwttttt",
            "wwwwIIIw",
            "wHwttttt",
            "wwwwwwww"
          ],
          "bgInk": [
            "..bbbbbb",
            "..bbbbbb",
            "..bbbbbb",
            "..bbbbbb",
            "..bbbbbb"
          ]
        },
        {
          "art": [
            "│└┬┴─┴─┴",
            "├o┤/⠉⠉⠉⠉",
            "───=|||=",
            "├o┤\\____",
            "│┌┴┬─┬─┬"
          ],
          "ink": [
            "wwwwwwww",
            "wIwttttt",
            "wwwwJJJw",
            "wIwttttt",
            "wwwwwwww"
          ],
          "bgInk": [
            "..bbbbbb",
            "..bbbbbb",
            "..bbbbbb",
            "..bbbbbb",
            "..bbbbbb"
          ]
        },
        {
          "art": [
            "│└┬┴─┴─┴",
            "├o┤/⠉⠉⠉⠉",
            "───=|||=",
            "├o┤\\____",
            "│┌┴┬─┬─┬"
          ],
          "ink": [
            "wwwwwwww",
            "wJwttttt",
            "wwwwFFFw",
            "wJwttttt",
            "wwwwwwww"
          ],
          "bgInk": [
            "..bbbbbb",
            "..bbbbbb",
            "..bbbbbb",
            "..bbbbbb",
            "..bbbbbb"
          ]
        }
      ]
    },
    "bot": {
      "art": [
        "⢣│⠿│o│:│",
        "\\├─┴─┴─┴",
        " │⣒⣒/⣒⣒/",
        " └┬─┴─┬─",
        "  ⠉⠤⣀⣀⣀⣀"
      ],
      "ink": [
        "wwjwFwjw",
        "wwwwwwww",
        ".wjjwjjw",
        ".wwwwwww",
        "..wjjjjj"
      ],
      "bgInk": [
        "..bbbbbb",
        "..bbbbbb",
        "..bbbbbb",
        "..bbbbbb",
        "..bbbbbb"
      ],
      "frames": [
        {
          "art": [
            "⢣│⠿│o│:│",
            "\\├─┴─┴─┴",
            " │⣒⣒/⣒⣒/",
            " └┬─┴─┬─",
            "  ⠉⠤⣀⣀⣀⣀"
          ],
          "ink": [
            "wwjwGwjw",
            "wwwwwwww",
            ".wjjwjjw",
            ".wwwwwww",
            "..wjjjjj"
          ],
          "bgInk": [
            "..bbbbbb",
            "..bbbbbb",
            "..bbbbbb",
            "..bbbbbb",
            "..bbbbbb"
          ]
        },
        {
          "art": [
            "⢣│⠿│o│:│",
            "\\├─┴─┴─┴",
            " │⣒⣒/⣒⣒/",
            " └┬─┴─┬─",
            "  ⠉⠤⣀⣀⣀⣀"
          ],
          "ink": [
            "wwjwHwjw",
            "wwwwwwww",
            ".wjjwjjw",
            ".wwwwwww",
            "..wjjjjj"
          ],
          "bgInk": [
            "..bbbbbb",
            "..bbbbbb",
            "..bbbbbb",
            "..bbbbbb",
            "..bbbbbb"
          ]
        },
        {
          "art": [
            "⢣│⠿│o│:│",
            "\\├─┴─┴─┴",
            " │⣒⣒/⣒⣒/",
            " └┬─┴─┬─",
            "  ⠉⠤⣀⣀⣀⣀"
          ],
          "ink": [
            "wwjwIwjw",
            "wwwwwwww",
            ".wjjwjjw",
            ".wwwwwww",
            "..wjjjjj"
          ],
          "bgInk": [
            "..bbbbbb",
            "..bbbbbb",
            "..bbbbbb",
            "..bbbbbb",
            "..bbbbbb"
          ]
        },
        {
          "art": [
            "⢣│⠿│o│:│",
            "\\├─┴─┴─┴",
            " │⣒⣒/⣒⣒/",
            " └┬─┴─┬─",
            "  ⠉⠤⣀⣀⣀⣀"
          ],
          "ink": [
            "wwjwJwjw",
            "wwwwwwww",
            ".wjjwjjw",
            ".wwwwwww",
            "..wjjjjj"
          ],
          "bgInk": [
            "..bbbbbb",
            "..bbbbbb",
            "..bbbbbb",
            "..bbbbbb",
            "..bbbbbb"
          ]
        }
      ]
    }
  },
  "inkMap": {
    "0": "core.face.dust_shine_0",
    "1": "core.face.dust_shine_1",
    "2": "core.face.dust_shine_2",
    "3": "core.face.dust_shine_3",
    "4": "core.face.dust_shine_4",
    ".": null,
    "s": "core.face.soil",
    "d": "core.face.dust",
    "r": "core.face.slate",
    "h": "core.face.facet",
    "c": "core.face.cleft",
    "o": "core.face.ore",
    "m": "core.face.mineral",
    "w": "core.face.wall",
    "j": "core.face.mortar",
    "t": "core.face.steel",
    "b": "core.face.shadow",
    "l": "core.face.lamp",
    "A": "core.face.ore_shine_0",
    "B": "core.face.ore_shine_1",
    "C": "core.face.ore_shine_2",
    "D": "core.face.ore_shine_3",
    "E": "core.face.ore_shine_4",
    "F": "core.face.lamp_breathe_0",
    "G": "core.face.lamp_breathe_1",
    "H": "core.face.lamp_breathe_2",
    "I": "core.face.lamp_breathe_3",
    "J": "core.face.lamp_breathe_4",
    "k": "core.face.crest"
  }
}
